### ISSUE TITLE
Music Assistant neverstarts playing

### ISSUE THREAD

**Issue by raymonvdm** [music-assistant/hass-music-assistant#929]
### What version of Music Assistant has the issue?

2022.8.4

### The problem

I have added some local files to the /media folder, MA sees the local folder but i cannot browse it, no error but the process bar only scrolls, the local files work fine using the HomeAssistant Media Browser

I have added my Spotify account and can browse al music and playlist, i can cast songs to chromecast devices, but the song never starts en stays at 00:00 

Port 8095 is open on the firewall so i`m not sure what the problem is

### How to reproduce

Install Home Assistant Core on Ubuntu 22.04.01 and Music Assisant using HACS

### Relevant log output

When playing using the HomeAssistant Media Player
```
2022-10-02 15:02:46.097 DEBUG (MainThread) [homeassistant.components.cast.media_player] [media_player.margrietwekker MargrietWekker] Playing {'media_id': 'https://host.domain.com:xxxx/media/local/AllTheLostSouls/02-james_blunt-one_of_the_brightest_stars.mp3?authSig=eyJ0eXAiOiJKV1QiLCJhbGciOiJIUzI1NiJ9.eyJpc3MiOiJlNzc3ZTdkYjI1MWU0NTFmYWI3N2QxMTQ2YTQ4YzUzZiIsInBhdGgiOiIvbWVkaWEvbG9jYWwvQWxsVGhlTG9zdFNvdWxzLzAyLWphbWVzX2JsdW50LW9uZV9vZl90aGVfYnJpZ2h0ZXN0X3N0YXJzLm1wMyIsInBhcmFtcyI6e30sImlhdCI6MTY2NDcyMjk2NiwiZXhwIjoxNjY0ODA5MzY2fQ.UW6BmikqFMX5DRPi2iy_x-db0CoUSXoleIS5gztEDCM', 'media_type': 'audio/mpeg'} with default_media_receiver
```

This log is not there when using Music Assistant

### What version of Home Assistant Core are your running

2022.9.7

### What type of installation are you running?

Home Assistant Core

### On what type of hardware are you running?

Generic x86-64 (e.g. Intel NUC)

**Comment by raymonvdm** [comment]
However i see some activity using TCPdump

```
15:14:22.391237 IP 192.168.112.79.49012 > 192.168.110.35.8095: Flags [S], seq 3697407411, win 29200, options [mss 1460,sackOK,TS val 43947908 ecr 0,nop,wscale 6], length 0
15:14:22.391288 IP 192.168.110.35.8095 > 192.168.112.79.49012: Flags [S.], seq 3996698204, ack 3697407412, win 65160, options [mss 1460,sackOK,TS val 615929317 ecr 43947908,nop,wscale 7], length 0
15:14:22.477969 IP 192.168.112.79.49012 > 192.168.110.35.8095: Flags [.], ack 1, win 457, options [nop,nop,TS val 43947945 ecr 615929317], length 0
15:14:22.477969 IP 192.168.112.79.49012 > 192.168.110.35.8095: Flags [P.], seq 1:543, ack 1, win 457, options [nop,nop,TS val 43947945 ecr 615929317], length 542
15:14:22.478062 IP 192.168.110.35.8095 > 192.168.112.79.49012: Flags [.], ack 543, win 505, options [nop,nop,TS val 615929403 ecr 43947945], length 0
15:14:22.480140 IP 192.168.110.35.8095 > 192.168.112.79.49012: Flags [P.], seq 1:369, ack 543, win 505, options [nop,nop,TS val 615929405 ecr 43947945], length 368
15:14:22.481488 IP 192.168.112.79.49012 > 192.168.110.35.8095: Flags [.], ack 369, win 473, options [nop,nop,TS val 43948004 ecr 615929405], length 0
```

But what is the definition of local network? My Wireless and Fysical devices are not in the same subnet, maybe MA webserver is only limited to 192.168.110.0/24 in this case?

**Comment by OzGav** [comment]
Please refer to the first entry of this FAQ https://github.com/music-assistant/hass-music-assistant/discussions/709

**Comment by raymonvdm** [comment]
Moved them to the same vlan, but still nog success

**Comment by OzGav** [comment]
We need more information to help as per that FAQ I linked. For example, what is your internal HA url set to?

**Comment by OzGav** [comment]
Also try and send a regular TTS message from HA to the original speaker entity and the mass entity and advise what happens

**Comment by raymonvdm** [comment]
> Also try and send a regular TTS message from HA to the original speaker entity and the mass entity and advise what happens

I already have several TTS messages which are always working fine, the only problem i have is with Music Assistant

**Comment by OzGav** [comment]
You are not answering my question. I am asking you to send those TTS messages to the MA player/speaker entity

**Comment by OzGav** [comment]
You should also have `media_player.mass_babbelscherm`

**Comment by raymonvdm** [comment]
> You should also have `media_player.mass_babbelscherm`

Nope, no mass entities

**Comment by OzGav** [comment]
Have you done the second last dot point here https://github.com/music-assistant/hass-music-assistant#usage-and-notes

**Comment by raymonvdm** [comment]
> Have you done the second last dot point here https://github.com/music-assistant/hass-music-assistant#usage-and-notes

I have done now, the MASS entities are unable to do TTS

**Comment by OzGav** [comment]
Yeah ok your internal url doesn’t look right. HA should be accessed on port 8123 and although I believe some domains will resolve to the local IP you should try as I have
![D0BBF3FD-5743-48DC-A7F8-DF951D100BAD](https://user-images.githubusercontent.com/19848947/193561798-f98cac5c-5da9-4cbd-bfa2-3e809cb43907.jpeg)

**Comment by raymonvdm** [comment]
I created a new machine with fresh installation of Ubuntu and Home Assistant Core and the same issue hits me, but this time with an error

```
FileNotFoundError: [Errno 2] No such file or directory: 'ffmpeg'
```

**Comment by raymonvdm** [comment]
> I created a new machine with fresh installation of Ubuntu and Home Assistant Core and the same issue hits me, but this time with an error
> 
> ```
> FileNotFoundError: [Errno 2] No such file or directory: 'ffmpeg'
> ```

```
sudo apt install ffmpeg
```
Fixed the issue of playing spotify songs, next up is to check local file play

**Comment by OzGav** [comment]
I will close this as local will work assuming you can get the mount to work ok in your setup. If not the next version of MA is planned to have native SMB support
